{
  "$schema": "https://json-schema.org/draft/2020-12/schema",
  "$id": "delivery-action-receipt.schema.json",
  "title": "Exact delivery action authorization receipt",
  "type": "object",
  "required": [
    "id",
    "kind",
    "schema_version",
    "profile_ref",
    "delivery",
    "action",
    "effective_level",
    "checkpoint_required",
    "approval",
    "runtime_target",
    "action_details",
    "authorization_receipt_ref",
    "local_release_verification",
    "evidence",
    "outcome",
    "status",
    "authorized_by",
    "authorized_at",
    "audit",
    "receipt_hash",
    "hash_algorithm"
  ],
  "properties": {
    "id": { "type": "string", "minLength": 1 },
    "kind": { "const": "delivery_action_receipt" },
    "schema_version": {
      "enum": [
        "delivery-action-receipt:v1",
        "delivery-action-receipt:v2"
      ]
    },
    "profile_ref": { "$ref": "#/$defs/path_hashed_id_ref" },
    "delivery": {
      "type": "object",
      "required": ["id", "kind"],
      "properties": {
        "id": { "type": "string", "minLength": 1 },
        "kind": { "enum": ["pull_request", "local_release"] }
      },
      "additionalProperties": false
    },
    "action": { "type": "string", "minLength": 1 },
    "effective_level": { "enum": ["supervised", "checkpointed", "bounded-autonomous"] },
    "checkpoint_required": { "type": "boolean" },
    "approval": {
      "oneOf": [
        { "type": "null" },
        { "type": "object" }
      ]
    },
    "runtime_target": {
      "oneOf": [
        { "type": "null" },
        {
          "type": "object",
          "required": ["branch", "head_sha", "base_ref", "base_sha", "matching_remotes", "remote_fingerprint"],
          "properties": {
            "branch": { "type": "string", "minLength": 1 },
            "head_sha": { "type": "string", "minLength": 1 },
            "base_ref": { "type": "string", "minLength": 1 },
            "base_sha": { "type": "string", "minLength": 1 },
            "matching_remotes": { "type": "array", "minItems": 1, "items": { "type": "string", "minLength": 1 } },
            "remote_fingerprint": { "$ref": "#/$defs/sha256" }
          },
          "additionalProperties": false
        }
      ]
    },
    "action_details": {
      "type": "object",
      "properties": {
        "provider_operation": { "$ref": "#/$defs/provider_operation_binding" }
      }
    },
    "authorization_receipt_ref": {
      "oneOf": [
        { "type": "null" },
        { "$ref": "#/$defs/path_hashed_id_ref" }
      ]
    },
    "completion_request": {
      "type": "object",
      "required": [
        "schema_version",
        "profile_ref",
        "action",
        "outcome",
        "authorization_receipt_ref",
        "evidence",
        "operation_args",
        "request_hash",
        "hash_algorithm"
      ],
      "properties": {
        "schema_version": { "const": "delivery-action-completion-request:v1" },
        "profile_ref": { "$ref": "#/$defs/path_hashed_id_ref" },
        "action": { "type": "string", "minLength": 1 },
        "outcome": { "enum": ["passed", "failed"] },
        "authorization_receipt_ref": { "$ref": "#/$defs/path_hashed_id_ref" },
        "evidence": {
          "type": "array",
          "minItems": 1,
          "items": { "$ref": "#/$defs/path_hash" }
        },
        "operation_args": {
          "type": "object",
          "properties": {
            "scope_paths": {
              "type": "array",
              "items": { "type": "string", "minLength": 1 }
            },
            "remote": { "type": ["string", "null"] },
            "pr_url": { "type": ["string", "null"] },
            "expected_pr_title": { "type": ["string", "null"] },
            "expected_pr_body_sha256": { "type": ["string", "null"] },
            "expected_pr_state": { "type": ["string", "null"] },
            "expected_pr_base": { "type": ["string", "null"] },
            "smoke_cwd": { "type": ["string", "null"] },
            "smoke_tests": {
              "type": "array",
              "items": { "type": "string", "minLength": 2, "pattern": "^\\[.*\\]$" }
            },
            "rollback": { "type": ["string", "null"] }
          },
          "additionalProperties": false
        },
        "request_hash": { "$ref": "#/$defs/sha256" },
        "hash_algorithm": { "const": "sha256:stable-json:v1" }
      },
      "additionalProperties": false
    },
    "local_release_verification": {
      "oneOf": [
        { "type": "null" },
        {
          "type": "object",
          "required": ["target_root", "allowed_write_paths", "smoke_tests", "smoke_test_receipts", "outcome", "evidence", "rollback"],
          "properties": {
            "target_root": { "type": "string", "minLength": 1 },
            "allowed_write_paths": { "type": "array", "minItems": 1, "items": { "type": "string", "minLength": 1 } },
            "smoke_tests": { "type": "array", "minItems": 1, "uniqueItems": true, "items": { "type": "string", "minLength": 2, "pattern": "^\\[.*\\]$" } },
            "smoke_cwd": { "type": "string", "minLength": 1 },
            "smoke_test_receipts": {
              "type": "array",
              "minItems": 1,
              "items": {
                "type": "object",
                "required": ["command", "cwd", "sandbox", "exit_code", "signal", "error_code", "outcome", "stdout_sha256", "stderr_sha256", "started_at", "finished_at"],
                "properties": {
                  "command": { "type": "array", "minItems": 1, "items": { "type": "string", "minLength": 1 } },
                  "cwd": { "type": "string", "minLength": 1 },
                  "sandbox": { "enum": ["macos-sandbox-exec-readonly-no-network", "linux-bwrap-readonly-no-network"] },
                  "exit_code": { "type": ["integer", "null"] },
                  "signal": { "type": ["string", "null"] },
                  "error_code": { "type": ["string", "null"] },
                  "outcome": { "enum": ["passed", "failed"] },
                  "stdout_sha256": { "$ref": "#/$defs/sha256" },
                  "stderr_sha256": { "$ref": "#/$defs/sha256" },
                  "started_at": { "type": "string", "format": "date-time" },
                  "finished_at": { "type": "string", "format": "date-time" }
                },
                "additionalProperties": false
              }
            },
            "outcome": { "const": "passed" },
            "evidence": { "type": "array", "minItems": 1, "items": { "$ref": "#/$defs/path_hash" } },
            "rollback": {
              "type": "object",
              "required": ["required", "procedure"],
              "properties": {
                "required": { "const": true },
                "procedure": { "type": "string", "minLength": 1 },
                "verification_required": { "const": true }
              },
              "additionalProperties": false
            },
            "rollback_verification_receipt_ref": { "$ref": "#/$defs/path_hashed_id_ref" },
            "data_migration_sequence": { "$ref": "#/$defs/data_migration_sequence" }
          },
          "additionalProperties": false
        }
      ]
    },
    "rollback_verification": { "$ref": "#/$defs/rollback_verification" },
    "data_operation_verification": { "$ref": "#/$defs/data_operation_verification" },
    "evidence": { "type": "array", "items": { "$ref": "#/$defs/path_hash" } },
    "outcome": { "type": ["string", "null"], "enum": [null, "passed", "failed"] },
    "status": { "enum": ["authorized", "completed"] },
    "authorized_by": { "$ref": "common.schema.json#/$defs/actor" },
    "authorized_at": { "type": "string", "format": "date-time" },
    "audit": { "$ref": "common.schema.json#/$defs/audit" },
    "receipt_hash": { "$ref": "#/$defs/sha256" },
    "hash_algorithm": { "const": "sha256:stable-json:v1" }
  },
  "allOf": [
    {
      "if": {
        "properties": {
          "schema_version": { "const": "delivery-action-receipt:v2" },
          "status": { "const": "completed" }
        },
        "required": ["schema_version", "status"]
      },
      "then": {
        "required": ["completion_request"]
      }
    },
    {
      "if": {
        "properties": {
          "schema_version": { "const": "delivery-action-receipt:v2" },
          "status": { "const": "authorized" }
        },
        "required": ["schema_version", "status"]
      },
      "then": {
        "not": { "required": ["completion_request"] }
      }
    },
    {
      "if": { "properties": { "status": { "const": "completed" } }, "required": ["status"] },
      "then": {
        "properties": {
          "authorization_receipt_ref": { "$ref": "#/$defs/path_hashed_id_ref" },
          "outcome": { "enum": ["passed", "failed"] },
          "evidence": { "type": "array", "minItems": 1, "items": { "$ref": "#/$defs/path_hash" } }
        }
      }
    },
    {
      "if": { "properties": { "status": { "const": "authorized" } }, "required": ["status"] },
      "then": {
        "properties": {
          "authorization_receipt_ref": { "const": null },
          "outcome": { "const": null },
          "local_release_verification": { "const": null }
        }
      }
    },
    {
      "if": {
        "properties": {
          "action": { "const": "git.push" }
        },
        "required": ["action"]
      },
      "then": {
        "properties": {
          "action_details": { "required": ["push", "base_precondition", "push_precondition"] }
        }
      }
    },
    {
      "if": {
        "properties": {
          "status": { "const": "completed" },
          "outcome": { "const": "passed" },
          "action": { "const": "git.commit" }
        },
        "required": ["status", "outcome", "action"]
      },
      "then": { "properties": { "action_details": { "required": ["commit"] } } }
    },
    {
      "if": {
        "properties": {
          "status": { "const": "completed" },
          "outcome": { "const": "passed" },
          "action": { "const": "git.push" }
        },
        "required": ["status", "outcome", "action"]
      },
      "then": {
        "properties": {
          "action_details": { "required": ["push", "base_precondition", "push_precondition", "remote_verification"] }
        }
      }
    },
    {
      "if": {
        "properties": {
          "status": { "const": "completed" },
          "outcome": { "const": "passed" },
          "action": { "const": "pull_request.merge" }
        },
        "required": ["status", "outcome", "action"]
      },
      "then": {
        "properties": {
          "action_details": { "required": ["merge", "merge_precondition", "provider_verification"] }
        }
      }
    },
    {
      "if": {
        "properties": {
          "status": { "const": "completed" },
          "outcome": { "const": "passed" },
          "action": { "const": "release.local" }
        },
        "required": ["status", "outcome", "action"]
      },
      "then": {
        "properties": {
          "local_release_verification": { "type": "object" }
        }
      }
    },
    {
      "if": {
        "properties": {
          "status": { "const": "completed" },
          "outcome": { "const": "passed" },
          "action": { "enum": ["data.migrate", "data.rollback"] }
        },
        "required": ["status", "outcome", "action"]
      },
      "then": {
        "required": ["data_operation_verification"],
        "properties": {
          "data_operation_verification": { "$ref": "#/$defs/data_operation_verification" }
        }
      }
    },
    {
      "if": {
        "properties": {
          "status": { "const": "completed" },
          "outcome": { "const": "passed" },
          "action": { "const": "rollback.verify" }
        },
        "required": ["status", "outcome", "action"]
      },
      "then": {
        "required": ["rollback_verification"],
        "properties": {
          "rollback_verification": { "$ref": "#/$defs/rollback_verification" }
        }
      }
    }
  ],
  "$defs": {
    "sha256": { "type": "string", "pattern": "^[a-f0-9]{64}$" },
    "path_hash": {
      "type": "object",
      "required": ["path", "sha256"],
      "properties": {
        "path": { "type": "string", "minLength": 1 },
        "sha256": { "$ref": "#/$defs/sha256" }
      },
      "additionalProperties": false
    },
    "path_hashed_id_ref": {
      "type": "object",
      "required": ["id", "path", "hash"],
      "properties": {
        "id": { "type": "string", "minLength": 1 },
        "path": { "type": "string", "minLength": 1 },
        "hash": { "$ref": "#/$defs/sha256" }
      },
      "additionalProperties": false
    },
    "data_operation_verification": {
      "type": "object",
      "required": [
        "action",
        "transition",
        "target_path",
        "scopes",
        "backup_path",
        "preview_evidence",
        "before_target_sha256",
        "after_target_sha256",
        "backup_sha256",
        "rollback_procedure",
        "rollback_verified"
      ],
      "properties": {
        "action": { "enum": ["data.migrate", "data.rollback"] },
        "transition": { "enum": ["migrated", "rolled_back"] },
        "target_path": { "type": "string", "minLength": 1 },
        "scopes": {
          "type": "array",
          "minItems": 1,
          "uniqueItems": true,
          "items": { "type": "string", "minLength": 1 }
        },
        "backup_path": { "type": "string", "minLength": 1 },
        "preview_evidence": {
          "type": "array",
          "minItems": 1,
          "uniqueItems": true,
          "items": { "$ref": "#/$defs/path_hash" }
        },
        "before_target_sha256": { "$ref": "#/$defs/sha256" },
        "after_target_sha256": { "$ref": "#/$defs/sha256" },
        "backup_sha256": { "$ref": "#/$defs/sha256" },
        "rollback_procedure": { "type": "string", "minLength": 1 },
        "rollback_verified": { "type": "boolean" }
      },
      "allOf": [
        {
          "if": { "properties": { "action": { "const": "data.migrate" } }, "required": ["action"] },
          "then": {
            "properties": {
              "transition": { "const": "migrated" },
              "rollback_verified": { "const": false }
            }
          },
          "else": {
            "properties": {
              "transition": { "const": "rolled_back" },
              "rollback_verified": { "const": true }
            }
          }
        }
      ],
      "additionalProperties": false
    },
    "rollback_verification": {
      "type": "object",
      "required": [
        "action",
        "target_root",
        "allowed_write_paths",
        "rollback_procedure",
        "evidence_root",
        "evidence",
        "verification",
        "verified"
      ],
      "properties": {
        "action": { "const": "rollback.verify" },
        "target_root": { "type": "string", "minLength": 1 },
        "allowed_write_paths": {
          "type": "array",
          "minItems": 1,
          "uniqueItems": true,
          "items": { "type": "string", "minLength": 1 }
        },
        "rollback_procedure": { "type": "string", "minLength": 1 },
        "evidence_root": { "type": "string", "minLength": 1 },
        "data_rollback_receipt_ref": { "$ref": "#/$defs/path_hashed_id_ref" },
        "evidence": {
          "type": "array",
          "minItems": 1,
          "uniqueItems": true,
          "items": { "$ref": "#/$defs/path_hash" }
        },
        "verification": { "const": "evidence_verified" },
        "verified": { "const": true }
      },
      "additionalProperties": false
    },
    "data_migration_sequence": {
      "type": "object",
      "required": [
        "data_rollback_receipt_ref",
        "final_data_migration_receipt_ref",
        "rollback_verification_receipt_ref"
      ],
      "properties": {
        "data_rollback_receipt_ref": { "$ref": "#/$defs/path_hashed_id_ref" },
        "final_data_migration_receipt_ref": { "$ref": "#/$defs/path_hashed_id_ref" },
        "rollback_verification_receipt_ref": { "$ref": "#/$defs/path_hashed_id_ref" }
      },
      "additionalProperties": false
    },
    "provider_operation_binding": {
      "type": "object",
      "required": ["binding", "precondition_receipt", "completion_receipt"],
      "properties": {
        "binding": {
          "type": "object",
          "required": ["action", "provider_id", "source", "provider_bindings_hash"],
          "properties": {
            "action": { "type": "string", "pattern": "^[a-z0-9][a-z0-9._-]*$" },
            "provider_id": { "type": "string", "pattern": "^[a-z0-9][a-z0-9._-]*$" },
            "source": { "enum": ["explicit-v2", "legacy-v1"] },
            "provider_bindings_hash": {
              "oneOf": [
                { "type": "null" },
                { "$ref": "#/$defs/sha256" }
              ]
            }
          },
          "additionalProperties": false
        },
        "precondition_receipt": { "$ref": "provider-operation-receipt.schema.json" },
        "completion_receipt": {
          "oneOf": [
            { "type": "null" },
            { "$ref": "provider-operation-receipt.schema.json" }
          ]
        }
      },
      "additionalProperties": false
    }
  },
  "additionalProperties": false
}
