{
  "id": "AUT-ACT-20260719015340646-1e122d",
  "kind": "delivery_action_receipt",
  "schema_version": "delivery-action-receipt:v1",
  "profile_ref": {
    "id": "AUT-PR-ENT-PORTFOLIO-R4",
    "path": ".sdlc/autonomy/deliveries/AUT-PR-ENT-PORTFOLIO-R4.json",
    "hash": "ebd7ef768dbad2ddbf8d8de3875b56d8b73dfb9ef53fda5da48f38f25e666dc1"
  },
  "delivery": {
    "id": "PR-ENT-PORTFOLIO-R4",
    "kind": "pull_request"
  },
  "action": "git.commit",
  "effective_level": "checkpointed",
  "checkpoint_required": false,
  "approval": null,
  "runtime_target": {
    "branch": "codex/ST-ENT-PORTFOLIO",
    "head_sha": "6acce0d1d5dfb45e49a0eac83cf7c5f547a7684f",
    "base_ref": "refs/remotes/origin/main",
    "base_sha": "a135641fa474e623ac07ccd428d4bd9eff438dc2",
    "matching_remotes": [
      "origin"
    ],
    "remote_fingerprint": "df707842131d7433e8156d5e9a0119611543fa356c4f052ad8cc52683526ff71"
  },
  "action_details": {
    "repository": "github.com/aantenore/agentic-sdlc-codex-plugin",
    "base_branch": "main",
    "head_branch": "codex/ST-ENT-PORTFOLIO",
    "source_sha": "6acce0d1d5dfb45e49a0eac83cf7c5f547a7684f",
    "changed_paths": [
      ".sdlc/autonomy/actions/AUT-ACT-20260719014301541-62f355.json",
      ".sdlc/autonomy/actions/AUT-ACT-20260719014322294-22172d.json",
      ".sdlc/autonomy/actions/AUT-ACT-20260719014949667-f750ec.json",
      ".sdlc/autonomy/actions/AUT-ACT-20260719015005818-cff2d3.json",
      ".sdlc/autonomy/actions/AUT-ACT-20260719015128305-00df3e.json",
      ".sdlc/autonomy/actions/AUT-ACT-20260719015141956-161a9a.json",
      ".sdlc/autonomy/actions/AUT-ACT-20260719015146842-9f7a40.json",
      ".sdlc/autonomy/actions/AUT-ACT-20260719015209053-ea216c.json",
      ".sdlc/autonomy/approvals/AUT-APR-20260719015246031-b1bd8e.json",
      ".sdlc/autonomy/decisions/AUT-DEC-20260719015246033-3fb39c.json",
      ".sdlc/autonomy/decisions/AUT-DEC-20260719015326314-c98f8b.json",
      ".sdlc/autonomy/deliveries/AUT-PR-ENT-PORTFOLIO-R4.json",
      ".sdlc/autonomy/executions/AUT-PR-ENT-PORTFOLIO-R3/close.json",
      ".sdlc/autonomy/executions/AUT-PR-ENT-PORTFOLIO-R4/start.json",
      ".sdlc/baseline/BASELINE-ENTERPRISE-PLATFORM-006-current-state.md",
      ".sdlc/baseline/BASELINE-ENTERPRISE-PLATFORM-006.json",
      ".sdlc/contracts/contract-ST-ENT-PORTFOLIO-R2-implementation-v4.json",
      ".sdlc/stories/ST-ENT-PORTFOLIO-R2/evidence/git-commit-6acce0d.json",
      ".sdlc/stories/ST-ENT-PORTFOLIO-R2/evidence/git-commit-87cc572.json",
      ".sdlc/stories/ST-ENT-PORTFOLIO-R2/evidence/git-commit-930aefb.json",
      ".sdlc/stories/ST-ENT-PORTFOLIO-R2/evidence/git-push-6acce0d.json",
      ".sdlc/stories/ST-ENT-PORTFOLIO-R2/story.json",
      ".sdlc/stories/ST-ENT-PORTFOLIO-R2/task-start.json",
      ".sdlc/traces/.integrity/ST-ENT-PORTFOLIO-R2.jsonl.checkpoint.json",
      ".sdlc/traces/.integrity/project.jsonl.checkpoint.json",
      ".sdlc/traces/ST-ENT-PORTFOLIO-R2.jsonl",
      ".sdlc/traces/project.jsonl"
    ],
    "allowed_write_paths": [
      ".sdlc",
      "README.md",
      "bin",
      "docs",
      "lib",
      "package.json",
      "schemas",
      "scripts",
      "test",
      "ui"
    ],
    "commit_snapshot": {
      "schema_version": "git-commit-index-snapshot:v1",
      "object_format": "sha1",
      "source_head_sha": "6acce0d1d5dfb45e49a0eac83cf7c5f547a7684f",
      "index_tree_oid": "9b66127d485710a3d4b910546e4767a23fc140c6",
      "staged_paths": [
        ".sdlc/autonomy/actions/AUT-ACT-20260719014301541-62f355.json",
        ".sdlc/autonomy/actions/AUT-ACT-20260719014322294-22172d.json",
        ".sdlc/autonomy/actions/AUT-ACT-20260719014949667-f750ec.json",
        ".sdlc/autonomy/actions/AUT-ACT-20260719015005818-cff2d3.json",
        ".sdlc/autonomy/actions/AUT-ACT-20260719015128305-00df3e.json",
        ".sdlc/autonomy/actions/AUT-ACT-20260719015141956-161a9a.json",
        ".sdlc/autonomy/actions/AUT-ACT-20260719015146842-9f7a40.json",
        ".sdlc/autonomy/actions/AUT-ACT-20260719015209053-ea216c.json",
        ".sdlc/autonomy/approvals/AUT-APR-20260719015246031-b1bd8e.json",
        ".sdlc/autonomy/decisions/AUT-DEC-20260719015246033-3fb39c.json",
        ".sdlc/autonomy/decisions/AUT-DEC-20260719015326314-c98f8b.json",
        ".sdlc/autonomy/deliveries/AUT-PR-ENT-PORTFOLIO-R4.json",
        ".sdlc/autonomy/executions/AUT-PR-ENT-PORTFOLIO-R3/close.json",
        ".sdlc/autonomy/executions/AUT-PR-ENT-PORTFOLIO-R4/start.json",
        ".sdlc/baseline/BASELINE-ENTERPRISE-PLATFORM-006-current-state.md",
        ".sdlc/baseline/BASELINE-ENTERPRISE-PLATFORM-006.json",
        ".sdlc/contracts/contract-ST-ENT-PORTFOLIO-R2-implementation-v4.json",
        ".sdlc/stories/ST-ENT-PORTFOLIO-R2/evidence/git-commit-6acce0d.json",
        ".sdlc/stories/ST-ENT-PORTFOLIO-R2/evidence/git-commit-87cc572.json",
        ".sdlc/stories/ST-ENT-PORTFOLIO-R2/evidence/git-commit-930aefb.json",
        ".sdlc/stories/ST-ENT-PORTFOLIO-R2/evidence/git-push-6acce0d.json",
        ".sdlc/stories/ST-ENT-PORTFOLIO-R2/story.json",
        ".sdlc/stories/ST-ENT-PORTFOLIO-R2/task-start.json",
        ".sdlc/traces/.integrity/ST-ENT-PORTFOLIO-R2.jsonl.checkpoint.json",
        ".sdlc/traces/.integrity/project.jsonl.checkpoint.json",
        ".sdlc/traces/ST-ENT-PORTFOLIO-R2.jsonl",
        ".sdlc/traces/project.jsonl"
      ]
    },
    "checkpoint_policy": {
      "schema_version": "delivery-action-checkpoint-policy:v1",
      "action": "git.commit",
      "delivery_kind": "pull_request",
      "effective_level": "checkpointed",
      "profile_ref": {
        "id": "AUT-PR-ENT-PORTFOLIO-R4",
        "hash": "ebd7ef768dbad2ddbf8d8de3875b56d8b73dfb9ef53fda5da48f38f25e666dc1"
      },
      "preset_checkpoints": [
        "deploy.remote",
        "pull_request.merge",
        "release.local"
      ],
      "policy_source_ref": {
        "path": ".sdlc/autonomy/policy-sources/7095312897dda3792325d84788983c807ec75b000f051fcf051d7e884e38e1a9.json",
        "hash": "7095312897dda3792325d84788983c807ec75b000f051fcf051d7e884e38e1a9",
        "effective_config_hash": "446f8d6a1d417fe2db152245d1b0f304c36da27199cb2b3daddfa6178e87c7d0"
      },
      "profile_checkpoints": [
        "deploy.remote",
        "pull_request.merge"
      ],
      "boundary_actions": [
        "deploy.remote",
        "pull_request.merge"
      ],
      "local_boundary_checkpoint": false,
      "local_boundary_source": null,
      "local_boundary_source_hash": null,
      "required": false,
      "policy_hash": "d5e58d98e4f6fed451d94a4d88b41834e52a719b12915de7a20456d7ac5b2082"
    }
  },
  "authorization_receipt_ref": null,
  "local_release_verification": null,
  "evidence": [],
  "outcome": null,
  "status": "authorized",
  "authorized_by": {
    "id": "codex",
    "type": "agent",
    "name": "Codex",
    "email": null,
    "source": "default"
  },
  "authorized_at": "2026-07-19T01:53:40.646Z",
  "audit": {
    "git": {
      "is_git_repo": true,
      "branch": "codex/ST-ENT-PORTFOLIO",
      "head_sha": "6acce0d1d5dfb45e49a0eac83cf7c5f547a7684f",
      "is_dirty": true,
      "user": {
        "name": "Antonio Antenore",
        "email": "ant_ant95@hotmail.it"
      },
      "remotes": [
        "origin"
      ]
    },
    "run": {
      "run_id": null,
      "thread_id": "019f6f22-ba84-7631-bdaf-b074e51dba5d",
      "session_id": null,
      "tool": "agentic-sdlc-cli",
      "version": "0.11.0"
    }
  },
  "receipt_hash": "e1c479f4cc3f70ae91c290e659289cfd61f3f0d7cfc1a7859b93e0e7816d8d7a",
  "hash_algorithm": "sha256:stable-json:v1"
}
