{
  "id": "AUT-ACT-20260719010309271-f89d8e",
  "kind": "delivery_action_receipt",
  "schema_version": "delivery-action-receipt:v1",
  "profile_ref": {
    "id": "AUT-PR-ENT-PORTFOLIO-R3",
    "path": ".sdlc/autonomy/deliveries/AUT-PR-ENT-PORTFOLIO-R3.json",
    "hash": "ba4dbe9e2d3ff1bc5f570bafaf687b2a1965a0fe9fffb590b8429a4fec6b53ac"
  },
  "delivery": {
    "id": "PR-ENT-PORTFOLIO-R3",
    "kind": "pull_request"
  },
  "action": "git.commit",
  "effective_level": "checkpointed",
  "checkpoint_required": false,
  "approval": null,
  "runtime_target": {
    "branch": "codex/ST-ENT-PORTFOLIO",
    "head_sha": "fa0da01a72e160b389233fa27151199b93119a2d",
    "base_ref": "refs/remotes/origin/main",
    "base_sha": "a135641fa474e623ac07ccd428d4bd9eff438dc2",
    "matching_remotes": [
      "origin"
    ],
    "remote_fingerprint": "df707842131d7433e8156d5e9a0119611543fa356c4f052ad8cc52683526ff71"
  },
  "action_details": {
    "repository": "github.com/aantenore/agentic-sdlc-codex-plugin",
    "base_branch": "main",
    "head_branch": "codex/ST-ENT-PORTFOLIO",
    "source_sha": "fa0da01a72e160b389233fa27151199b93119a2d",
    "changed_paths": [
      "lib/change-observatory/index.mjs",
      "lib/change-observatory/operations.mjs",
      "lib/change-observatory/portfolio-collector.mjs",
      "lib/change-observatory/portfolio-project-summary.mjs",
      "lib/change-observatory/portfolio-runtime.mjs",
      "lib/change-observatory/project-runtime.mjs",
      "lib/change-observatory/server.mjs",
      "package.json",
      "test/unit/change-observatory-portfolio-collector.test.mjs",
      "test/unit/change-observatory-portfolio-project-summary.test.mjs",
      "test/unit/change-observatory-portfolio-runtime.test.mjs",
      "test/unit/change-observatory-portfolio-server.test.mjs",
      "test/unit/change-observatory-portfolio-ui.test.mjs",
      "ui/change-observatory/portfolio.js"
    ],
    "allowed_write_paths": [
      ".sdlc",
      "README.md",
      "bin",
      "docs",
      "lib",
      "package.json",
      "schemas",
      "scripts",
      "test",
      "ui"
    ],
    "commit_snapshot": {
      "schema_version": "git-commit-index-snapshot:v1",
      "object_format": "sha1",
      "source_head_sha": "fa0da01a72e160b389233fa27151199b93119a2d",
      "index_tree_oid": "028d30901b3ae3238abd5dc108db6f02ee64308d",
      "staged_paths": [
        "lib/change-observatory/index.mjs",
        "lib/change-observatory/operations.mjs",
        "lib/change-observatory/portfolio-collector.mjs",
        "lib/change-observatory/portfolio-project-summary.mjs",
        "lib/change-observatory/portfolio-runtime.mjs",
        "lib/change-observatory/project-runtime.mjs",
        "lib/change-observatory/server.mjs",
        "package.json",
        "test/unit/change-observatory-portfolio-collector.test.mjs",
        "test/unit/change-observatory-portfolio-project-summary.test.mjs",
        "test/unit/change-observatory-portfolio-runtime.test.mjs",
        "test/unit/change-observatory-portfolio-server.test.mjs",
        "test/unit/change-observatory-portfolio-ui.test.mjs",
        "ui/change-observatory/portfolio.js"
      ]
    },
    "checkpoint_policy": {
      "schema_version": "delivery-action-checkpoint-policy:v1",
      "action": "git.commit",
      "delivery_kind": "pull_request",
      "effective_level": "checkpointed",
      "profile_ref": {
        "id": "AUT-PR-ENT-PORTFOLIO-R3",
        "hash": "ba4dbe9e2d3ff1bc5f570bafaf687b2a1965a0fe9fffb590b8429a4fec6b53ac"
      },
      "preset_checkpoints": [
        "deploy.remote",
        "pull_request.merge",
        "release.local"
      ],
      "policy_source_ref": {
        "path": ".sdlc/autonomy/policy-sources/7095312897dda3792325d84788983c807ec75b000f051fcf051d7e884e38e1a9.json",
        "hash": "7095312897dda3792325d84788983c807ec75b000f051fcf051d7e884e38e1a9",
        "effective_config_hash": "446f8d6a1d417fe2db152245d1b0f304c36da27199cb2b3daddfa6178e87c7d0"
      },
      "profile_checkpoints": [
        "deploy.remote",
        "pull_request.merge"
      ],
      "boundary_actions": [
        "deploy.remote",
        "pull_request.merge"
      ],
      "local_boundary_checkpoint": false,
      "local_boundary_source": null,
      "local_boundary_source_hash": null,
      "required": false,
      "policy_hash": "3a4bc468e3d52f92220c9b06426305f068eb8e7de4e12f601b6fefcaa11c97e1"
    }
  },
  "authorization_receipt_ref": null,
  "local_release_verification": null,
  "evidence": [],
  "outcome": null,
  "status": "authorized",
  "authorized_by": {
    "id": "antonioantenore",
    "type": "human",
    "name": "Antonio Antenore",
    "email": "antonio.antenore@gmail.com",
    "source": "environment"
  },
  "authorized_at": "2026-07-19T01:03:09.271Z",
  "audit": {
    "git": {
      "is_git_repo": true,
      "branch": "codex/ST-ENT-PORTFOLIO",
      "head_sha": "fa0da01a72e160b389233fa27151199b93119a2d",
      "is_dirty": true,
      "user": {
        "name": "Antonio Antenore",
        "email": "ant_ant95@hotmail.it"
      },
      "remotes": [
        "origin"
      ]
    },
    "run": {
      "run_id": null,
      "thread_id": "019f6f22-ba84-7631-bdaf-b074e51dba5d",
      "session_id": null,
      "tool": "agentic-sdlc-cli",
      "version": "0.11.0"
    }
  },
  "receipt_hash": "8a89ca8398440f493edd838dd25cbd912efda98b33b0950f2390a451936457ae",
  "hash_algorithm": "sha256:stable-json:v1"
}
