{
  "id": "AUT-ACT-20260718115418993-7ce1ac",
  "kind": "delivery_action_receipt",
  "schema_version": "delivery-action-receipt:v1",
  "profile_ref": {
    "id": "AUT-PR-ENT-OBSERVABILITY",
    "path": ".sdlc/autonomy/deliveries/AUT-PR-ENT-OBSERVABILITY.json",
    "hash": "8ded0a39b0089cb963d9f12c1ea7ea6e591cdecaa70e3dcf41dad7fff9375236"
  },
  "delivery": {
    "id": "PR-ENT-OBSERVABILITY",
    "kind": "pull_request"
  },
  "action": "git.commit",
  "effective_level": "checkpointed",
  "checkpoint_required": false,
  "approval": null,
  "runtime_target": {
    "branch": "codex/ST-ENT-OBSERVABILITY",
    "head_sha": "ef098b34a004a09ea1279b591901f467e8523389",
    "base_ref": "refs/remotes/origin/main",
    "base_sha": "35868d26c667dcbc22e61277bc25c26869595191",
    "matching_remotes": [
      "origin"
    ],
    "remote_fingerprint": "df707842131d7433e8156d5e9a0119611543fa356c4f052ad8cc52683526ff71"
  },
  "action_details": {
    "repository": "github.com/aantenore/agentic-sdlc-codex-plugin",
    "base_branch": "main",
    "head_branch": "codex/ST-ENT-OBSERVABILITY",
    "source_sha": "ef098b34a004a09ea1279b591901f467e8523389",
    "changed_paths": [
      "lib/change-observatory/bounded-file-reader.mjs",
      "lib/observability/context.mjs",
      "lib/observability/index.mjs",
      "lib/observability/metrics.mjs",
      "lib/observability/redaction.mjs",
      "lib/observability/support-bundle.mjs",
      "lib/trace-integrity.mjs",
      "schemas/trace-integrity-checkpoint.schema.json",
      "test/unit/change-observatory-bounded-file-reader.test.mjs",
      "test/unit/obs-context.test.mjs",
      "test/unit/obs-metrics.test.mjs",
      "test/unit/obs-redaction.test.mjs",
      "test/unit/obs-support-bundle.test.mjs",
      "test/unit/trace-integrity.test.mjs"
    ],
    "allowed_write_paths": [
      ".sdlc",
      "README.md",
      "bin",
      "docs",
      "lib",
      "package.json",
      "schemas",
      "scripts",
      "skills",
      "templates",
      "test",
      "ui"
    ],
    "commit_snapshot": {
      "schema_version": "git-commit-index-snapshot:v1",
      "object_format": "sha1",
      "source_head_sha": "ef098b34a004a09ea1279b591901f467e8523389",
      "index_tree_oid": "03ef1e087ff607598c1f8b78a118d5058049294f",
      "staged_paths": [
        "lib/change-observatory/bounded-file-reader.mjs",
        "lib/observability/context.mjs",
        "lib/observability/index.mjs",
        "lib/observability/metrics.mjs",
        "lib/observability/redaction.mjs",
        "lib/observability/support-bundle.mjs",
        "lib/trace-integrity.mjs",
        "schemas/trace-integrity-checkpoint.schema.json",
        "test/unit/change-observatory-bounded-file-reader.test.mjs",
        "test/unit/obs-context.test.mjs",
        "test/unit/obs-metrics.test.mjs",
        "test/unit/obs-redaction.test.mjs",
        "test/unit/obs-support-bundle.test.mjs",
        "test/unit/trace-integrity.test.mjs"
      ]
    },
    "checkpoint_policy": {
      "schema_version": "delivery-action-checkpoint-policy:v1",
      "action": "git.commit",
      "delivery_kind": "pull_request",
      "effective_level": "checkpointed",
      "profile_ref": {
        "id": "AUT-PR-ENT-OBSERVABILITY",
        "hash": "8ded0a39b0089cb963d9f12c1ea7ea6e591cdecaa70e3dcf41dad7fff9375236"
      },
      "preset_checkpoints": [
        "deploy.remote",
        "pull_request.merge",
        "release.local"
      ],
      "policy_source_ref": {
        "path": ".sdlc/autonomy/policy-sources/7095312897dda3792325d84788983c807ec75b000f051fcf051d7e884e38e1a9.json",
        "hash": "7095312897dda3792325d84788983c807ec75b000f051fcf051d7e884e38e1a9",
        "effective_config_hash": "446f8d6a1d417fe2db152245d1b0f304c36da27199cb2b3daddfa6178e87c7d0"
      },
      "profile_checkpoints": [
        "deploy.remote",
        "pull_request.merge"
      ],
      "boundary_actions": [
        "deploy.remote",
        "pull_request.merge"
      ],
      "local_boundary_checkpoint": false,
      "local_boundary_source": null,
      "local_boundary_source_hash": null,
      "required": false,
      "policy_hash": "0a2ed9c537674a4802609dff3828722314f08d6a0c6912bc5088ee61f3b1eb75"
    }
  },
  "authorization_receipt_ref": null,
  "local_release_verification": null,
  "evidence": [],
  "outcome": null,
  "status": "authorized",
  "authorized_by": {
    "id": "codex",
    "type": "agent",
    "name": "Codex",
    "email": null,
    "source": "default"
  },
  "authorized_at": "2026-07-18T11:54:18.993Z",
  "audit": {
    "git": {
      "is_git_repo": true,
      "branch": "codex/ST-ENT-OBSERVABILITY",
      "head_sha": "ef098b34a004a09ea1279b591901f467e8523389",
      "is_dirty": true,
      "user": {
        "name": "Antonio Antenore",
        "email": "ant_ant95@hotmail.it"
      },
      "remotes": [
        "origin"
      ]
    },
    "run": {
      "run_id": null,
      "thread_id": "019f6f22-ba84-7631-bdaf-b074e51dba5d",
      "session_id": null,
      "tool": "agentic-sdlc-cli",
      "version": "0.11.0"
    }
  },
  "receipt_hash": "ae7f510c8435df3d37559e6abe40bcac06438c2932b83fb1fc937a2f0158be0e",
  "hash_algorithm": "sha256:stable-json:v1"
}
