{
  "id": "AUT-ACT-20260719033307443-dd06fc",
  "kind": "delivery_action_receipt",
  "schema_version": "delivery-action-receipt:v1",
  "profile_ref": {
    "id": "AUT-PR-ENT-RELEASE-R1",
    "path": ".sdlc/autonomy/deliveries/AUT-PR-ENT-RELEASE-R1.json",
    "hash": "966d3f78becca0afacd6f17e255fb9cafc00a43e29611f78a1d3eb4e5dde555b"
  },
  "delivery": {
    "id": "PR-ENT-RELEASE-R1",
    "kind": "pull_request"
  },
  "action": "git.commit",
  "effective_level": "checkpointed",
  "checkpoint_required": false,
  "approval": null,
  "runtime_target": {
    "branch": "codex/ST-ENT-RELEASE",
    "head_sha": "272456e69d84a098fb9f0f334d2e3eeb41568836",
    "base_ref": "refs/remotes/origin/main",
    "base_sha": "3ad39d8c6c5386c2588830fa95fa7fed4fa49c7e",
    "matching_remotes": [
      "origin"
    ],
    "remote_fingerprint": "df707842131d7433e8156d5e9a0119611543fa356c4f052ad8cc52683526ff71"
  },
  "action_details": {
    "repository": "github.com/aantenore/agentic-sdlc-codex-plugin",
    "base_branch": "main",
    "head_branch": "codex/ST-ENT-RELEASE",
    "source_sha": "272456e69d84a098fb9f0f334d2e3eeb41568836",
    "changed_paths": [
      "test/unit/release-artifact-verifier.test.mjs"
    ],
    "allowed_write_paths": [
      ".codex-plugin",
      ".github",
      ".sdlc",
      "README.md",
      "config",
      "docs",
      "lib",
      "package.json",
      "schemas",
      "scripts",
      "test"
    ],
    "commit_snapshot": {
      "schema_version": "git-commit-index-snapshot:v1",
      "object_format": "sha1",
      "source_head_sha": "272456e69d84a098fb9f0f334d2e3eeb41568836",
      "index_tree_oid": "5079cfd24e5b4e638a6ed2b69e8692401599698c",
      "staged_paths": [
        "test/unit/release-artifact-verifier.test.mjs"
      ]
    },
    "checkpoint_policy": {
      "schema_version": "delivery-action-checkpoint-policy:v1",
      "action": "git.commit",
      "delivery_kind": "pull_request",
      "effective_level": "checkpointed",
      "profile_ref": {
        "id": "AUT-PR-ENT-RELEASE-R1",
        "hash": "966d3f78becca0afacd6f17e255fb9cafc00a43e29611f78a1d3eb4e5dde555b"
      },
      "preset_checkpoints": [
        "deploy.remote",
        "pull_request.merge",
        "release.local"
      ],
      "policy_source_ref": {
        "path": ".sdlc/autonomy/policy-sources/7095312897dda3792325d84788983c807ec75b000f051fcf051d7e884e38e1a9.json",
        "hash": "7095312897dda3792325d84788983c807ec75b000f051fcf051d7e884e38e1a9",
        "effective_config_hash": "446f8d6a1d417fe2db152245d1b0f304c36da27199cb2b3daddfa6178e87c7d0"
      },
      "profile_checkpoints": [
        "deploy.remote",
        "pull_request.merge"
      ],
      "boundary_actions": [
        "deploy.remote",
        "pull_request.merge"
      ],
      "local_boundary_checkpoint": false,
      "local_boundary_source": null,
      "local_boundary_source_hash": null,
      "required": false,
      "policy_hash": "ad612ceea8c90f127fd0b10cf7bc4207cfd6c13e46b4e45c421f4570da0f6176"
    }
  },
  "authorization_receipt_ref": null,
  "local_release_verification": null,
  "evidence": [],
  "outcome": null,
  "status": "authorized",
  "authorized_by": {
    "id": "antonioantenore",
    "type": "human",
    "name": "Antonio Antenore",
    "email": "ant_ant95@hotmail.it",
    "source": "environment"
  },
  "authorized_at": "2026-07-19T03:33:07.443Z",
  "audit": {
    "git": {
      "is_git_repo": true,
      "branch": "codex/ST-ENT-RELEASE",
      "head_sha": "272456e69d84a098fb9f0f334d2e3eeb41568836",
      "is_dirty": true,
      "user": {
        "name": "Antonio Antenore",
        "email": "ant_ant95@hotmail.it"
      },
      "remotes": [
        "origin"
      ]
    },
    "run": {
      "run_id": null,
      "thread_id": "019f6f22-ba84-7631-bdaf-b074e51dba5d",
      "session_id": null,
      "tool": "agentic-sdlc-cli",
      "version": "0.11.0"
    }
  },
  "receipt_hash": "82e9288a540275eaf02d9f066dcc3f31ca9484c0c6efa12669cfd26a54ffb1d8",
  "hash_algorithm": "sha256:stable-json:v1"
}
